{
  "schema_version": 1,
  "app_id": "dev.doodad.calculator",
  "domain_revision": 2,
  "observed_at_ms": 1000,
  "freshness": "stale",
  "declared_surfaces": [
    "app",
    "voice"
  ],
  "surfaces": {
    "app": {
      "revision": 2,
      "screen_id": "calculator.home",
      "title": "Calculator",
      "summary": "42",
      "state": {
        "provider": "mock",
        "interactive": true,
        "freshness": "stale"
      }
    },
    "voice": {
      "revision": 2,
      "actions": [
        {
          "id": "calculator.primary",
          "example": "Calculate",
          "confirmation": "never"
        }
      ]
    }
  }
}
