{
  "schema_version": 1,
  "app_id": "dev.doodad.navigation",
  "domain_revision": 3,
  "observed_at_ms": 2000,
  "freshness": "current",
  "declared_surfaces": [
    "app",
    "glance",
    "complication",
    "notification",
    "ongoing",
    "voice"
  ],
  "surfaces": {
    "app": {
      "revision": 3,
      "screen_id": "navigation.home",
      "title": "Navigation",
      "summary": "Turn in 200 ft",
      "state": {
        "provider": "mock",
        "interactive": true,
        "freshness": "current"
      }
    },
    "glance": {
      "revision": 3,
      "template": "ongoing",
      "title": "Navigation",
      "primary": "Turn in 200 ft",
      "secondary": "Updated now",
      "action": {
        "id": "navigation.primary",
        "label": "Start route"
      }
    },
    "complication": {
      "revision": 3,
      "label": "Navigation",
      "value": "Turn in 200 ft",
      "icon": "navigation"
    },
    "notification": {
      "revision": 3,
      "status": "inactive"
    },
    "ongoing": {
      "revision": 3,
      "status": "active",
      "title": "Navigation",
      "detail": "Turn in 200 ft",
      "actions": [
        {
          "id": "navigation.primary",
          "label": "Start route"
        }
      ]
    },
    "voice": {
      "revision": 3,
      "actions": [
        {
          "id": "navigation.primary",
          "example": "Start route",
          "confirmation": "never"
        }
      ]
    }
  }
}
