{
  "schema_version": 1,
  "app_id": "dev.doodad.sleep",
  "domain_revision": 2,
  "observed_at_ms": 1000,
  "freshness": "stale",
  "declared_surfaces": [
    "app",
    "glance",
    "complication",
    "notification",
    "ongoing",
    "voice"
  ],
  "surfaces": {
    "app": {
      "revision": 2,
      "screen_id": "sleep.home",
      "title": "Sleep + Smart Alarm",
      "summary": "7h 42m",
      "state": {
        "provider": "mock",
        "interactive": true,
        "freshness": "stale"
      }
    },
    "glance": {
      "revision": 2,
      "template": "ongoing",
      "title": "Sleep + Smart Alarm",
      "primary": "7h 42m",
      "secondary": "Cached · 18 min",
      "action": {
        "id": "sleep.primary",
        "label": "Start sleep"
      }
    },
    "complication": {
      "revision": 2,
      "label": "Sleep + Smart Alarm",
      "value": "7h 42m",
      "icon": "sleep"
    },
    "notification": {
      "revision": 2,
      "status": "inactive"
    },
    "ongoing": {
      "revision": 2,
      "status": "active",
      "title": "Sleep + Smart Alarm",
      "detail": "7h 42m",
      "actions": [
        {
          "id": "sleep.primary",
          "label": "Start sleep"
        }
      ]
    },
    "voice": {
      "revision": 2,
      "actions": [
        {
          "id": "sleep.primary",
          "example": "Start sleep",
          "confirmation": "never"
        }
      ]
    }
  }
}
