{
  "schema_version": 1,
  "app_id": "dev.doodad.calories",
  "domain_revision": 3,
  "observed_at_ms": 2000,
  "freshness": "current",
  "declared_surfaces": [
    "app",
    "glance",
    "complication",
    "notification",
    "voice"
  ],
  "surfaces": {
    "app": {
      "revision": 3,
      "screen_id": "calories.home",
      "title": "Nutrition + Hydration",
      "summary": "1,420 of 2,000",
      "state": {
        "provider": "mock",
        "interactive": true,
        "freshness": "current"
      }
    },
    "glance": {
      "revision": 3,
      "template": "metric",
      "title": "Nutrition + Hydration",
      "primary": "1,420 of 2,000",
      "secondary": "Updated now",
      "action": {
        "id": "calories.primary",
        "label": "Quick add"
      }
    },
    "complication": {
      "revision": 3,
      "label": "Nutrition + Hydration",
      "value": "1,420 of 2,000",
      "icon": "calories"
    },
    "notification": {
      "revision": 3,
      "status": "inactive"
    },
    "voice": {
      "revision": 3,
      "actions": [
        {
          "id": "calories.primary",
          "example": "Quick add",
          "confirmation": "never"
        }
      ]
    }
  }
}
